{"$schema":"https://json-schema.org/draft/2020-12/schema","type":"object","required":["schemaVersion","platform","domain","classification","controlPlane","edge","identity","platformBff","integrationGateway","engineApi","providerAccess","security","audit","secrets","failClosed","productionEvidenceRequired","rollback"],"properties":{"schemaVersion":{"const":"1.0.0"},"platform":{"type":"string"},"domain":{"type":"string"},"classification":{"enum":["corporate-public","product-public","private-application"]},"controlPlane":{"const":"SQAILE"},"edge":{"const":"Cloudflare"},"identity":{"const":"QuIdentify"},"platformBff":{"const":"required"},"integrationGateway":{"const":"QuHub"},"engineApi":{"const":"private"},"providerAccess":{"const":"connector-only"},"security":{"type":"array","contains":{"const":"QuFense"}},"audit":{"const":"QuAudit"},"operations":{"type":"array"},"secrets":{"type":"string","pattern":"QuVault"},"failClosed":{"const":true},"productionEvidenceRequired":{"const":true},"rollback":{"type":"string","minLength":10}},"additionalProperties":false}
