{"schemaVersion":"1.0.0","platform":"QnQ Platform","domain":"qnq.ooo","classification":"product-public","controlPlane":"SQAILE","edge":"Cloudflare","identity":"QuIdentify","platformBff":"required","integrationGateway":"QuHub","engineApi":"private","providerAccess":"connector-only","security":["QuFense","QuSOC"],"audit":"QuAudit","operations":["QuCOO","QuDeploy","QuSupport"],"secrets":"QuVault references only","failClosed":true,"productionEvidenceRequired":true,"rollback":"Git commit plus previous edge deployment"}
